,user,date,comment
265,durairaaj,05 Dec 2015 20:18 ,"Pasting of Amma's picture on aid packet was compelled by goons and local councillors. In Perungudi the AIADMK goons even threatened the aid providers and collected the food pockets and dropped in to the ditch. In other places they blocked the trucks entering Chennai to paste the poster of Amma on the aid packets. In cuddalore they stopped distribution of food packets.Its tragic and these inhuman people should be punished, but who will? It was aided by some policemen too. They were following the orders."
266,SaiK,05 Dec 2015 20:22 ,"chaanakya, your inference is correct, but your deduction is from a false premise. It requires a lot of AND ing."
267,SriKumar,05 Dec 2015 20:23 ,"Gus wrote:Srikumar - it remains to be seen if the SM fury will result in votes but the ones on the ground are expressing some righteous furyGus, it is good to see this righteous fury. It starts with expression of  fury, or atleast an opinion. The good news is that atleast it is being expressed. Whether or not they indulge in such cheap publicity next time, I do hope the people form an expectation that the govt (amma or kalaignar)  ought to pro-actively help in disaster situations, either through early warning and preparation, or disaster relief later on, and that it is the people's right to expect it. This applies to ALL of India and not just TN.Added later:Sorry to take it off on a political tangent. This is still an information-and-relief thread. (But any instances such as what durairaj posted above, should not be forgotten after normalcy returns)."
268,Gus,05 Dec 2015 20:26 ,http://thelogicalindian.com/news/my-sto ... materials/
269,chaanakya,05 Dec 2015 20:27 ,"SriKumar wrote: Exactly. It was bizarre when they declared the airport would open on Dec. 6th when water had even entered the terminal! If this picture is to be believed, water came out of the other side of the terminal into the drop-off/pickup areas.  ........Again, not sure if the pictures are for Chennai airport (it does say so) but the escalator area was  under almost knee-deep water. http://www.thecourierdaily.com/chennai- ... 2015/7645/I think water would have found its way into basement if there is a door to basement in vicinity. All the electrical connections/equipment  floor level and below will be damaged (escalator may have damage). One would expect basement to have a/c equipment, power distribution boxes etc. .Yes it is Chennai Domestic Arrival terminal. There is an elevated parking just opposite to it. So water could have found its way from there via entry road.The escalator is also for ground floor departure using buses. That is at ground and water from runway side could have entered into it. Scary.Generators are  there but due to flooding not operational.Terminal is generally leaking in normal times as reported in Aviation thread and newspapers from time to time. I am sure it can not withstand this type of rains.But I still hope operations to resume by tomorrow, at least day time as per PIB release."
270,chaanakya,05 Dec 2015 20:30 ,"SaiK wrote:chaanakya, your inference is correct, but your deduction is from a false premise. It requires a lot of AND ing.We can add n number of ANDs there. No issues. But that is not a false premise. It may not be sufficient or even necessary for deduction but needed for induction. Empirical observation only."
271,Gus,05 Dec 2015 20:30 ,Another story spreading that the goons tried this at an army relief vehicle and got dharma adi
272,chaanakya,05 Dec 2015 20:31 ,"Posting another Help message if someone needs it. From Whatsapp.Dear All could you please post this across your social media feeds? This is on behalf of Avinash and here is his message. ""I am putting together about 5 cars and drivers to commute back and forth between Bangalore and Chennai. If people need to be picked up from Chennai and brought to Bangalore or supplies need to be couriered from Bangalore to Chennai, we can help with the transport. Contact person Santhosh : +919538477108"" Regards Avinash"
273,deejay,05 Dec 2015 20:48 ,"durairaaj wrote:Pasting of Amma's picture on aid packet was compelled by goons and local councillors. In Perungudi the AIADMK goons even threatened the aid providers and collected the food pockets and dropped in to the ditch. In other places they blocked the trucks entering Chennai to paste the poster of Amma on the aid packets. In cuddalore they stopped distribution of food packets.Its tragic and these inhuman people should be punished, but who will? It was aided by some policemen too. They were following the orders.This also happened to our vehicle at Cuddlore. The vehicle was headed to the interiors of Cuddalore. A member from our society was accompanying the vehicle. He sent a WhatsApp message saying that the vehicle was stopped and Amma's adverts were stuck on all boxes without even asking. It was done despite protests that these cartons were being sent by people with no affiliation to TN politics and the senders were private citizens.Sad!"
274,Javee,05 Dec 2015 21:01 ,"Poorly done bit sorta conveys the magnitude of the rain water, http://m.indiatoday.in//video/chennai-r ... 37833.html"
275,chaanakya,05 Dec 2015 21:04 ,"PM announces ex-gratia relief from PM’s National Relief Fund, for those affected by heavy rains and floods in Tamil NaduThe Prime Minister, Shri Narendra Modi, has announced an ex-gratia relief of Rs. 2 lakhs each, from the Prime Minister’s National Relief Fund, for the next of kin of those who lost their lives in the floods dues to heavy rains in Tamil Nadu.An ex-gratia relief of Rs. 50,000 has also been sanctioned from the Prime Minister’s National Relief Fund for those who were seriously injured in the floods.***AKT/AK(Release ID :132588)http://pib.nic.in/newsite/erelease.aspx?relid=132588"
276,SaiK,05 Dec 2015 21:09 ,"the point is half truth is not truth. and the reason why politicians take advantage. so, bring out the ANDs."
277,chaanakya,05 Dec 2015 21:18 ,I thought other  brfites would be adding ANDs.
278,arshyam,05 Dec 2015 21:48 ,"chaanakya wrote:Chennai and TN in general , is full of good Samaritans. Perhaps result of Proselytisation. appreciate the work. I think even Bengaluru folks and NRIs have stood up to help.Appreciate that.Can we try to keep such nonsense away from this thread? Thanks."
279,chaanakya,05 Dec 2015 21:59 ,"you don't know the Story of Good samaritan , a parable told by Jesus himself, hence read that to get some sense in you.Last post of this nature before ban comes into effect. This is not the thread for it, and not sure BRF is the place for it. Proselytization is discouraged - JE Menon"
280,SaiK,05 Dec 2015 22:01 ,"enough.. if there is any truth, BRF members will proactively add it here."
281,chaanakya,05 Dec 2015 22:21 ,
282,sastri,05 Dec 2015 22:37 ,"SriKumar wrote:chaanakya wrote:Minister Sharma said commercial flight services cannot be resumed at the airport as of now. ""The airport's basement is still inundated with water. We should give it two days. Once power supply is restored and water evacuation happens, we can restart commercial flight services,"" he added.Exactly. It was bizarre when they declared the airport would open on Dec. 6th when water had even entered the terminal! If this picture is to be believed, water came out of the other side of the terminal into the drop-off/pickup areas. Again, not sure if the pictures are for Chennai airport (it does say so) but the escalator area was  under almost knee-deep water. http://www.thecourierdaily.com/chennai- ... 2015/7645/I think water would have found its way into basement if there is a door to basement in vicinity. All the electrical connections/equipment  floor level and below will be damaged (escalator may have damage). One would expect basement to have a/c equipment, power distribution boxes etc.From the above note by Chaanakya, it seems that the airport does not have power (maybe only emergency power), and they have not started pumping out water. Not sure but I think the floodwater is coming from Adayar river (judging by the silt deposited on the runway (it does not look like just rain water), upto runway and terminal, and unless Adayar recedes sufficiently, the airport can not prepare for commercial traffic (maybe just some military or emergency flights). Pure guess but after city power is restored to airport so pumping can begin, it might still be a week to make sure everything is functional and safe.svenkat: that video of saidapet bridge was scary.^^^ That's not Domestic terminal at Meenambakam in Chennai. Apparently that is Indra Gandhi Domestic terminal in Delhi, which was flooded in 2013.http://www.emirates247.com/news-in-images/delhi-airport-flooded-passengers-wade-through-2013-06-18-1.510863"
283,Gus,05 Dec 2015 22:42 ,Actually I see shares of a pic panning ej for distributing bibles. Even Muslim groups are getting praise for food distribution. And as usual the ones expressing remorse for making fun of vijaykant earlier because of him wading into water and distributing relief.
284,sastri,05 Dec 2015 22:55 ,It seems a few cargo flights were allowed to take-off from Chennai airport today morning. Below link provides the official statement on updated operational status of Chennai airport released by Ministry of Information and Broadcasting.http://inbministry.blogspot.in/2015/12/chennai-airport-operational-status.htmlAlsohttp://economictimes.indiatimes.com/news/politics-and-nation/rain-hit-chennai-airport-resumes-technical-flights/articleshow/50053847.cmsOurairports.com provides live flight information on ARRIVALS and DEPARTURE from Chennai. Also makeshift airports nearby Meenambakkam.http://ourairports.com/airports/VOMM/flights.htmlhttp://ourairports.com/airports/VOMM/closest.htmlhttp://ourairports.com/airports/VOMM/routes/
285,Gus,05 Dec 2015 23:05 ,"http://tinyurl.com/zxbeqjdparsed from my FB feed...link to army heli rescuing preg woman, who delivered twins later.."
286,Gus,05 Dec 2015 23:07 ,some stuff that reflect public mood...
287,SRoy,05 Dec 2015 23:09 ,Cross posting from Nukkad ... FOR BRFITES IN CHENNAI AND BANGALORE:Please call on +91 9538477108 for urgent transportation. The contact's name is Santhosh. They have 5-6 cars with drivers for to and fro trip.Put together by a chaddi buddy. Nau Sainik Bear driver ... you know here 
288,Gus,05 Dec 2015 23:10 ,"apparently parthasarathy temple, in muslim heavy area triplicane"
289,Gus,05 Dec 2015 23:21 ,"another popular oneproblem is, even though people realise both parties are crooks, during election time they don't find a viable attractive third alternative..bjp has missed the boat by not being visible in the streets doing protests, service etc..."
290,Gus,05 Dec 2015 23:24 ,"best one so farwe will take care of ourselves, move and put sticker.."
291,Gus,05 Dec 2015 23:30 ,army
292,chaanakya,05 Dec 2015 23:35 ,"sastri wrote: ^^^ That's not Domestic terminal at Meenambakam in Chennai. Apparently that is Indra Gandhi Domestic terminal in Delhi, which was flooded in 2013.http://www.emirates247.com/news-in-images/delhi-airport-flooded-passengers-wade-through-2013-06-18-1.510863I stand corrected. both are so familiar , somehow I missed  it."
293,member_27987,06 Dec 2015 00:16 ,"Chaps: Is the ""Sewa Bharathi"" same as ""Seva Bharathi"". http://www.sewabharathi.com/p/support-us.html and http://rashtriyasewa.org/ the same? I want to know which organisation to donate to. Don't want to fund some Paki organisation. IDRF is listed as an affiliate organisation in the first link."
294,vivek.rao,06 Dec 2015 03:59 ,
295,SaiK,06 Dec 2015 07:32 ,We collected totally today about 17K. With a huge potential for another 50K possible from local business community.Hopefully we will find a right channel to reach the needy.any suggestions I will pass it to our community decision group.we also think that other than Chennai places like cuddalore need help too
296,SSridhar,06 Dec 2015 07:40 ,"Low-pressure area exits Bay, but rains to stay over TN - Vinson Kurien, BusinessLine Thiruvananthapuram, Dec 5:  The several weeks-in-the-making low-pressure area has exited the Bay of Bengal to the South-West and lies over this (Saturday) afternoon over Sri Lanka and adjoining Comorin region, just off South Tamil Nadu.This would bring heavy to very rainfall to the West Coast of India starting from Kerala from the South to Coastal Karnataka and further northward into Goa-Konkan in the days to come.No all-clearHowever, this does not mean that Tamil Nadu gets the all-clear; this is because the easterly winds that flow into the 'low' emerge from the Bay and have to cross coastal and south interior Tamil Nadu.The moisture-laden winds would cause occasional rains over coastal Tamil Nadu, including Chennai and neighbourhood, over the next few days as well.Extended alertIndia Met Department has now extended the heavy rainfall warning along coastal Tamil Nadu, Puducherry and Kerala for three more days until Tuesday (December 8 ).But the US Centre for Climate Prediction sees possibility of heavy rainfall valid for the region, including Chennai and neighbouhood, for another week.This is because the 'low' will leave behind its parent trough more or less intact, which would continue to feed its offspring that lies in the Comorin region and adjoining Lakshadweep Sea.Cloud movementMeanwhile, intermittent drizzle to forceful rain has returned to haunt the flood-wary Chennai, which has recorded 4.8 cm of rain during the 24 hours ending at 4 pm this afternoon.Overcast conditions and a steady drizzle are being reported from parts of the metropolis from this morning as menacing clouds have started approaching mainly the Central and South-East coast of Tamil Nadu.Clouds have since engulfed the skies over the Chidambaram-Kumbakonam-Karaikal-Nagapattinam-Pattukottai-Vedaranniyam and the Ramanathapuram-Thoothukkudi-Tiruchendur-Kanya Kumari belts. "
297,SaiK,06 Dec 2015 07:49 ,"http://www.accuweather.com/en/in/national/satellite----------------http://www.hindustantimes.com/india/tam ... tsUQN.htmlIn flood-hit Tamil Nadu, CM won’t speak and officials can’t be quoted-------------------https://www.washingtonpost.com/news/cap ... nt-record/This remarkably strong El Niño has topped yet another significant recordhttps://www.washingtonpost.com/video/lo ... video.htmlHow El Niño will affect weather conditions this year[video]-------------------Human chain saves drowning man from Chennai floods – videohttp://www.theguardian.com/world/video/ ... CMP=twt_gu--------------------------ADG PI - INDIAN ARMY https://twitter.com/adgpiINDIAN ARMY - PROUD OF THE NATION-----------------------------Hoping to be not sucked into a manhole! racing against time: great photo--------------------------------Really Isolated here:---------------people to people help action:------------------The loss to the state and the people from the rain and flash floods this northeast monsoon season may have crossed a staggering Rs 50,000 crore already. And if the situation persists for the next few days, the total financial loss could escalate to a whopping Rs 1 lakh crorehttp://www.deccanchronicle.com/151206/n ... sand-croreLokesh et al, NOW TELL ME IF MASSAN STYLE INFRASTRUCTURE IS BETTER OR INDIC STYLE?----------------------------http://economictimes.indiatimes.com/new ... 057703.cmsOver 28,000 rescued-------------------------http://www.abplive.in/india-news/chenna ... els-255524Authorities shocked as water travelled to different part of cities through metro tunnelsIf metros are underground and stranded.. a sure death for all passenger.----------------------"
298,chaanakya,06 Dec 2015 11:01 ,"Its Sunny today after intermittent rains overnight,Water level has receded in most areas. My cousin left for his native place early this  morning after being evacuated. Central has started operating trains. He boarded coromandal. Huge rush. no seats. yet managed to enter the cmpt.Chennai is limping back to normal as are other areas.Now Kerala will face rains from residual moisture in the system."
299,SSridhar,06 Dec 2015 11:38 ,"chaanakya wrote:Its Sunny today after intermittent rains overnight,Not in many parts of south Chennai. It has been raining since morning almost non-stop, at times a bit heavily. It is still raining as I post this."
300,SaiK,06 Dec 2015 11:51 ,"It is unbelievable that many of you here, never believe the accuweather link I am constantly posting"
301,member_27987,06 Dec 2015 11:55 ,@SaiK. Kadaloore needs a lot of help especially with EJ vultures rubbing their hands in glee. Hence my question is are there genuine Indic orgs working there
302,chaanakya,06 Dec 2015 12:04 ,"SSridhar wrote:chaanakya wrote:Its Sunny today after intermittent rains overnight,Not in many parts of south Chennai. It has been raining since morning almost non-stop, at times a bit heavily. It is still raining as I post this.Could be in your parts. I am seeing sun shine. No rains for now."
303,SaiK,06 Dec 2015 12:06 ,dunno.. please tell me from first-hand info from there if you know any.
304,chaanakya,06 Dec 2015 13:08 ,Accuweather link does not work for the folk living in the area.
305,Comer,06 Dec 2015 15:02 ,https://www.facebook.com/Chennaites/vid ... 160249746/Brilliant stuff
306,chetak,06 Dec 2015 15:18 ,"maybe a version of this, with non corrosive aluminium bodies, can be made by Ordinance factories, specially for disaster management duties‘Seep’ used during WW II saves scores in Chennai‘Seep’ used during WW II saves scores in ChennaiSRUTHISAGAR YAMUNANVinayak Shankar with his 1943 Ford GPA Amphibious Seep with which he helped rescue services across Chennai. -Photo: Sruthisagar YamunanVinayak Shankar with his 1943 Ford GPA Amphibious Seep with which he helped rescue services across Chennai. -Photo: Sruthisagar YamunanBy March 1943, Ford had built 12,778 Seeps which marked its presence by dropping Allied troops on to Normandy in ‘Operation Neptune’ on June 6, 1944.Seventy-two years after it was first produced, the 1943 Ford GPA Amphibious Seep, which helped put thousands of Allied troops on the Normandy beach during World War II, came to the rescue of Chennai residents when a business man used the vehicle for extensive relief work.When Vinayak Shankar of Krishna Mines realised the proportions of the flooding in Chennai, he quickly called up his men in Tirunelveli to transport the Ford GPA on a truck to the city. When the ‘amphibious seep’ finally arrived on Tuesday, Mr. Shankar rushed to Kottupuram and met officials, offering to help in the rescue and relief efforts.By March 1943, Ford had built 12,778 Seeps which marked its presence by dropping Allied troops on to Normandy in ‘Operation Neptune’ on June 6, 1944.The landing is considered the most decisive military operations that quickened the destruction of the Nazi regime.While the officers in Chennai first hesitated, they quickly realised how efficient the ‘amphibious’ jeep was in manoeuvring in deep waters. In Kotturpuram, Mr. Shankar braved strong currents of the Adayar river in spate to distribute food packets to stranded residents. “At one point, the current was so strong that I swirled with the vehicle. I had to hook the vehicle to a building and then distribute the food packets,” he said.Mr. Shankar has a special mechanic, Udhayasuriyan, who has been with his family for thirty years and takes care of the Seep, which runs on petrol.“After World War II, the British brought a few of these vehicles to be put to use in the Brahmaputra. When they were leaving India, some were sold off to locals. My grandfather picked one,” he said.Mr. Shankar was so much in demand on Saturday that much of the food distribution to flood-affected colonies happened on his Seep. “When I looked at how the people were stranded, my conscience did not let me stay idle. Miners are usually seen as troublemakers. I also wanted to prove that notion wrong. We are also very much human,” he said.Ford GPA, deployed to drop Allied troops on Normandy Beach, delivers food packets"
307,prahaar,06 Dec 2015 15:21 ,That video is top class in so many ways. On FB some comment said the lady delivered twins after being rescued.
308,Singha,06 Dec 2015 15:29 ,World vision took a half page ad on page2  of toi today seeking donations...preferably in cashVultures are airborne are circling already
309,SSridhar,06 Dec 2015 15:51 ,"Met has just announced that a new low pressure area has formed and the next two days will see heavy to very heavy rains lashing coastal TN. In the 24 hrs ending this mng, Kancheepuram, Cuddalore, Chengalpat have recorded 16 to 17 Cms of rain. During the same time Chennai had 2 Cms. I am sure many parts of Chennai had more rains during the day today."
310,Singha,06 Dec 2015 16:17 ,"chennai trekking club had organized some rescues from deep water housing using truck tubes and in collab with blue cross saved some stranded animals also.they put together a kit to be distributed to families.https://fbcdn-sphotos-c-a.akamaihd.net/ ... 8172_o.jpgAs water levels have receded (initial rescue efforts over) and overwhelming immediate relief (ready-to-eat food and water) is flowing into the city, Chennai Trekking Club is directing its relief efforts to the next stage towards recovery of flood affected families. We are putting family relief kits consisting of:* clothes: sarees, lungis* non-perishable food items: rice, pulses, sugar, salt* basic cutlery: plates, tumblers, vessel, tea filter* night: bed sheets, sleeping mat, torch, candles* hygiene: towel, napkins, soap/shampoo, mosquito repellent/coilWe welcome people to contribute above materials or donate to our CTC relief fund: tinyurl.com/ctcflooddonate. Final distribution center of materials is Jaigopal Garodia National Higher Seconday School near East Tambaram. Contacts: Masu 9940630985 Prasanna 9994816896 Vinoth 9791013343"
311,chaanakya,06 Dec 2015 16:18 ,"New system is formed as seen here. Three days, abt , before it strikes the coast."
312,member_28108,06 Dec 2015 16:23 ,"One has to watch the tide level. If the high tide ""recedes"" even if there is rain it will drain into the sea. It appears Mondays height will be more. Hope the rains come after Monday to be allow the sea to ""absorb' the land effluent. http://tides.mobilegeographics.com/graphs/3611.png"
313,chaanakya,06 Dec 2015 16:24 ,Comer wrote:https://www.facebook.com/Chennaites/videos/898423160249746/Brilliant stuffSimply amazing.
