,user,date,comment
133,SwamyG,04 Dec 2015 04:02 ,"arshyam wrote:SwamyG wrote:For some reason the takleef of millions seem to have been brushed aside.Saar, this is what I was trying to express in Nukkad, when two mods descended on me with logic . What to do onlee, had to beat a hasty retreat   . But such events defy logic, and my ask was just a simple ack from the GoI to the ~100 people already dead and more marooned in the previous spells. At least now, GoI has openly swung into action, so no more complaints from me. But there was a time last month when people had wondered if GoI also based their decisions by watching the so-called ""national"" media It makes me wonder if it was the proverbial frog being slowly boiled in water. Following friends and family in Whatsapp group, the rain and its problems were being discussed in mid November itself. It was bad per what I read on the messages; there was a photo of a snake sitting on a toilet. I thought it was photoshoed. Lots of jokes were going around about the plight of people. Schools and offices were being closed, but lots of humor was still around - there was not a sense of panic. There were 100 deaths by this time. Slowly things started changing, each rain brought more problems. I think the last rain tipped it over. You need to know there is Save-Modi-Brigade in every corner of this World  . So if you ranted in nukkad, your choice of words did not go properly I guess. I tweeted a few times to Sri Modi Garu and his office onlee. Nammala moodichandu avalo dhan.Somebody in FB, had posted a tweet of Actor Siddarth who called out the national attention. The actual Madrasis are still not blaming anyone for the most part. The total has reached 269 deaths so far. I cannot imagine cases where water is well past the ground floor.Stay dry, stay safe."
134,SaiK,04 Dec 2015 04:05 ,arshyam and others. The Big Data here should guide further designs.I have become like Modiji.. I'm not going to give up on this saga!
135,SwamyG,04 Dec 2015 04:07 ,"Got this from NDTV. Wow, is this real and the current havoc?"
136,SwamyG,04 Dec 2015 04:10 ,"arshyam wrote:Re-posting the stats from the previous page to give an idea about capacity:[/code]As per skymetweather.com: In just 3 hours, from 8:30 am IST on December 1, Chennai recorded 73 mm of rain."
137,SwamyG,04 Dec 2015 04:11 ,
138,SwamyG,04 Dec 2015 04:14 ,shyam on Siddarth....more hear: http://www.dailyo.in/politics/chennai-f ... /7712.html
139,SwamyG,04 Dec 2015 04:22 ,"This guy who would have been called a failure by many people, who had troubled childhood, is now teaming with Siddarth & Chinmayi Sripaada to help people help others. Wow.https://en.wikipedia.org/wiki/RJ_Balaji"
140,SaiK,04 Dec 2015 04:29 ,"SwamyG wrote:Got this from NDTV. Wow, is this real and the current havoc?http://drop.ndtv.com/albums/uploadedpic ... 790029.jpgSomething doesn't jell correct here. Is it trees on top of it? Or is it my eyes need a doc check?"
141,SaiK,04 Dec 2015 04:34 ,what a voice chinmayi has! god bless her. hope she can sing for this flood that can easily donate 100 crores.
142,Sridhar K,04 Dec 2015 05:43 ,The Adyar river runs inside the western side of the airport. Part of the secondary runway is actually is over the runway
143,ramana,04 Dec 2015 06:21 ,ELM channels have started blame game even while  rescue  efforts are underway.And  interrupt military officers  to get sound  bytes.
144,SaiK,04 Dec 2015 07:10 ,"interesting to note here, people are moving both directions.The genius Ilayaraj on rescue mission044 - 25393514044 - 25363792044 - 25615025 (Chennai Police Helpline)"
145,SwamyG,04 Dec 2015 07:12 ,"How much ever well meaned, activists should stop writing in BBC types of organizations: http://www.bbc.com/news/world-asia-india-34992004Why wash dirty laundry in public laundromats? BBC just claps its hands in glee to parade India's takleef."
146,Rony,04 Dec 2015 07:20 ,"Telugu Actors who donated to Chennai floods so far as per reportsPrabhas - 50 Lakhs Allu Arjun - 25 LakhsMahesh Babu - 10 LakhsJr.NTR - 10 LakhsKalyanram - 5 lakhsRavi Teja - 5 lakhsSai dharam tej - 3 lakhsTarun Tej - 3 lakhsSandeep Kishan - provided food for 5000 people and still involved in live action helping peopleSmall time comedian Sampoornesh Babu - 50,000 rupees .He is the first to initiated the donations towards the relief camp and asking other cine colleagues to help for the cause."
147,disha,04 Dec 2015 07:54 ,I am feeling extremely sad and depressed looking at the loss of lives and destruction.I am not able to connect to one of the cousins in Chennai. All accounted for except him and nobody knows where that fellow is! Last was in Tambaram which has been severely affected. Just hoping for the best for everybody.
148,Surya,04 Dec 2015 07:58 ,Disha hope he is wellI lost my cousin to the mumbai floodsfor some god forsaken reason -  decided to make it back home by foot and fell into an open manhole - left behind 2 small childrenIts best to stay put in times like these
149,disha,04 Dec 2015 08:03 ,Surya wrote:for some god forsaken reason -  decided to make it back home by foot and fell into an open manhole - left behind 2 small childrenIts best to stay put in times like theseJust sad 
150,SaiK,04 Dec 2015 08:05 ,"pray, he is heard disha. so far, everyone I know directly is safe now. I haven't heard from few I normally don't keep in touch. we just hope, this rain stops for now.  but, it might be highly unlikely seeing this radar maphttp://www.accuweather.com/en/world/satellite /zoom in.unless some heavy winds change the direction away from Chennai down south.surya, sad to know.. that is something we have to tell. and also note down for future designs. No drains channels/manhole on the roads but only over the drains and clearly marked like within 4 feet from the edges. this standardization is needed so that, everyone knows where these manholes can be."
151,Sridhar K,04 Dec 2015 08:08 ,"Disha Which part of Tambaram. The eastern side is pretty ok. The IAF station on  the eastern side is from where rescue is being cordinatedEven on the western side Army has rescued a lot of people. Mobile network and power is down but death toll is very limited in that area.[url]https://m.facebook.com/story.php?story_fbid=897315330360529&id=218550298237039[/url]The issue now is loss of livelihood, essential commodities and safe drinking water."
152,Surya,04 Dec 2015 08:15 ,live wires and open manholes are a nightmare in mumbai floods
153,SriKumar,04 Dec 2015 08:18 ,"Are the bridges over Adayar functional (Saidapet, Kotturpuram and ADayar-near Theosophical Society)?There is a picture showing Saidpet bridge was crested- meaing all Mount Road traffic would stop at Saidapet."
154,Singha,04 Dec 2015 08:19 ,as a parent I would not imagine staying safely in some office and leaving my wife and kids to fend for themselves if they were in a vulnerable location. maybe thats the thought process he was in....RIP.
155,SaiK,04 Dec 2015 08:23 ,"my dad used to educate me that if you see even a small whirlpool, stay away from that spot. most likely it is an open drain or manhole.----------another bad thing about these natural disasters are that normally insurance don't cover it! one has to buy special insurance for natural disasters."
156,Sridhar K,04 Dec 2015 08:30 ,"SriKumar wrote:Are the bridges over Adayar functional (Saidapet, Kotturpuram and ADayar-near Theosophical Society)?There is a picture showing Saidpet bridge was crested- meaing all Mount Road traffic would stop at Saidapet.Saidapet and Kotturpuram are closed but the Adyar bridge has been operational all along."
157,SriKumar,04 Dec 2015 08:34 ,"Thanks. I had heard Kotturpuram was flooded so expecting that the bridge may have been crested. So, anyone coming from south of Adayar river will have to go all the way to the beach road to cross over to North Chennai. (Its a shame K'puram is closed...it was the most recent of the 3 bridges)."
158,Singha,04 Dec 2015 08:40 ,"from my reading, even knee deep swift flowing river water can knock a man over. anything more and you are surely down for the count."
159,SriKumar,04 Dec 2015 08:48 ,"^^^ I have seen atleast 2 videos, a very recent one (perhaps on BRF) where ankle-deep but fast flowing water (about 10 mph) washed a motor cycle off the road into a river.  ...totally shocked me, no warning on the video, nothing. Anything more than 5 inches to 10 inches of fast flowing water is dangerous to walk in, or even in a car. (Static water is a different story...more manageable.)."
160,Singha,04 Dec 2015 08:52 ,"^ yes my mistake. i had read of 10 inch of fast water being the limit for a adult man. less for old, women and kids."
161,chetak,04 Dec 2015 08:59 ,"disha wrote:I am feeling extremely sad and depressed looking at the loss of lives and destruction.I am not able to connect to one of the cousins in Chennai. All accounted for except him and nobody knows where that fellow is! Last was in Tambaram which has been severely affected. Just hoping for the best for everybody.If he has a voda phone connection, contact vodaphone offices in chennai and they can give you a last known location of that phone. This is an offer that vodaphone themselves have made."
162,Bade,04 Dec 2015 09:04 ,"Remember +2 physics of static forces..Only thing keeping you standing even without a water layer under your feet is the reaction force which balances your weight acting downwards in the opposite direction in equal amount. A layer of fast moving water becomes  like you on a inclined surface with a decreasing coefficient of friction and a much smaller component acting upwards, however small the inclination value may be to trigger a slip of the foot."
163,Gus,04 Dec 2015 09:05 ,Good that I booked my return via blr and not chn. Really worried about my friends and cousins though. Credit to regular people of chennai. They are doing rescue and relief in everywhich way they can.
164,SwamyG,04 Dec 2015 09:21 ,"My parents and siblings live in BLR, and my mom talked about the help Bangolreans are performing. She thinks there is still lots of humanity left in the country.Snakes sighted in one of my distant relatives house. People have vacated their homes.Looks like Camp Road, Selaiyur has relatively no flooding. They even have power."
165,deejay,04 Dec 2015 09:34 ,"SwamyG wrote:My parents and siblings live in BLR, and my mom talked about the help Bangolreans are performing. She thinks there is still lots of humanity left in the country.Snakes sighted in one of my distant relatives house. People have vacated their homes.Looks like Camp Road, Selaiyur has relatively no flooding. They even have power.A big donation camp for relief material has been organised in my society in Bangalore. Some stuff left for Chennai yesterday and some more will leave today. Mostly the following items are being sent:- Dry food items (expiry date is specially watched), Milk powder specially- Bottled water- Baby stuff (Diapers / baby care items), Sanitary napkins, hygiene items. - OTC medicines- Blankets (even if used but must be usable)Some volunteers have also left."
166,Javee,04 Dec 2015 09:50 ,"Finally, mobile and Internet working, left city this morning. Roads are back to normalcy in my area ( near Stella maris) , came through Poondamalli HR, relatively easy traffic with nil water on the roads. Our  area still has water logging, primarily water from Teynampet. CIT colony had a lot of water and so does some places in RA Puram. Santhome area was relatively better and so are areas around Mylapore. Overall we were in a much better situation than South and West. Kotturpuram is one of the worst hit this side of the river. One thing for sure, I went around yesterday, and people were orderly and calm, most stocked up on veggies and supplies. Ordinary citizens along with cops were Manning the roads, and after all the torture fest of 5-6 days didn't complaint much."
167,Aditya_V,04 Dec 2015 10:00 ,"Reached Office today, traffic jams are back in the city"
168,Javee,04 Dec 2015 10:08 ,"And the so called news media can go shove their reporter and concerns somewhere. The News reports were not objective, didn't give any new information for us and mostly related the content,CNN IBN being the worst with their self  congratulatory messages and NewsX channel was happy that they were the one to cover the events first. Infact a local  channel, Polymer gave updates on the roads that are open, about the power restoration and the bus/train updates. All these chi-chi networks should learn it from them. A simple area wise scroll on the flood situation would've helped us more than hijacking the twitter hash that folks created. Respect to all he people contributed to the rescue and relief work, particularly the city agencies, police and central agencies. The cops stood out in pouring rain and did an amazing job driving traffic. Also to the countless folks who posted/helped in SM-#chennairains #ChennaiRainsHelp."
169,SwamyG,04 Dec 2015 10:12 ,Once again SM helped more than the paid media. FB and WhatsApp has helped a lot.
170,Javee,04 Dec 2015 10:13 ,"Aditya_V wrote:Reached Office today, traffic jams are back in the cityYour kadamai unarchi, too much man. So many aanis at office? Shols Sez is shut for the 3rd day, I think will not reopen until Monday. Dumb @ss govt and the companies reap for what they did to Pallikaranai."
171,Bade,04 Dec 2015 10:16 ,"NDTV report showed the marsh land invaded by construction as well as garbage dumping. Following which when I checked google map, lo and behold they are claiming more of the marsh land. Oh well then !  No amount of canals and removing obstacles from existing drains, is going to help if they blatantly divide the marshes with roadways to block natural drainage. Why could they have not built on stilts instead. One can drive miles and miles in Louisiana through the bayous, all built on stilts."
172,Singha,04 Dec 2015 10:24 ,cost I suppose. dumping rocks and soil is much cheaper.
173,Bade,04 Dec 2015 10:30 ,"For a 100 yr event, it is a small price to pay perhaps..pass the buck down the road...but this is going to be a regular event after the fact, even with smaller amount of rainfall than what we saw with additional blockages planned in the name of development. I do hope the towns and cities of the west coast of India, which sees even more regular rainfall does not bite this tiger in the rear to keep up with the Joneses elsewhere."
174,ArmenT,04 Dec 2015 10:32 ,"From friend's post on FB:Here is the MOST RECENT update as of December 4, 9:00 AM IST.1. Kodambakkam - United India colony roads are dry. Power restored since yesterday evening. Internet down. Not been raining since yesterday evening. Shops are open too. 2. Chepauk and Triplicane - bright and shining! roads are dry and safe!3. Valasaravakkam - Water hasn't reduced - no current - no mobile network.4. Nanganallur - Water is draining quickly. Water level is around 1 feet. No water logs at every place. Signals might come all over by 11.5. West mambalam lake view road - knee level water and receding well.6. Arumbakkam - No water logging. Transport towards tirumangalam is on from CMBT.7. Purasawalkam high road- no rain, no water logging on main road. Streets do have water but manageable level.8. Egmore - coovum water which was in the streets receded overnight and power is back on for most of the part. Some streets are still water logged.9. Parry's - sunny! no water logging at Sowcarpet.10. Ayanavaram - no rain and no water logging here.. Anna Nagar - safe and no water logging. Power is back.11. Mamballam - T.nagar -- Water is below knee in most of the areas..12. From koyambed till kolathur stretch is absolutely normal13. Waters totally drained in Mudichur and Tambaram areas, now only 2 to 3 feet water in mudichur that too for 300 meters, power came in most of the areas and people start buying groceries and start cooking, so no worries.14. Medavakam to pallikaranai lotus pond stop no water.. But no power and no mobile network...15. Buses and share auto running between Tambaram to Medavakkam16. Buckingham canal to Ecr (SNR to Ecr connectivity road)..knee deep water17. Karapakkam ... Knee deep water on the road...18. Thiruvanmiyur signal to tidel.. 3 feet19. OMR to city access is best via Adyar bridge, RA puram, Nandanam, Gemini and further to central and pooonamalai rd20. Arcot road from Kodambakkam bridge till Alwarthirunagar is fine and clear..21. Beach road from Anna salai accessible via RK salai22. Velacherry - Baby nagar, Tansi nagar, Bharadhi naagar, Udhayam nagar, VGP Selva Nagar, Velachery Anna Nagar: Water level above 4 feet, in few other areas water level above neck.23. SRP tools to tidel park road is closed now (@ 3-Dec 9:00 PM IST)24. Jafarkhanpet and west saidapet water above neck level, peoples are rescue using boats (@3-Dec 9:00 PM IST)25. Narayanapuram till kamatchi hospital neck level water 26. Mahalingapuram - Clear sky and no water logging"
175,Javee,04 Dec 2015 10:41 ,"There was a plan to build an additional canal to drain excess water from the Marsh to Buckingham canal, somehow didn't materialize. That could've facilitated easy flow to the bay. I think we need to build more culverts across the Marsh to move more water effectively and stop encroachments on the lakes in the south.  All the enroachers got what they deserved,  SRM, Sathyabama,  Sez, SRMC, apartments built on mudichur, Koratur, Chitlapakkam lakes.DLF, Purvan Kara, Embassy, Lanco projects are all flooded.  I hope the consumers catch hold of the builders and shook them up, although they are as much responsible for this mess, as much as the builders and the govt. Last I heard Bollineni is paying about 2L per Villa for repairs and refurnishing."
176,ramana,04 Dec 2015 10:45 ,For relief!
177,ramana,04 Dec 2015 10:46 ,Is Cooum canal flushed finally?
178,Javee,04 Dec 2015 10:53 ,"Adyar is still running full, above msg from Armen says there are localities still in neck deep water. Cooum was flushed last week around, with the flushed garbage thrown back by the sea. The encroachments will take some time to come up on the riverbanks, but the sewage will needs to be plugged. The city agency has already started implementing a plan on this and some areas have already been covered."
179,SriKumar,04 Dec 2015 10:58 ,"Bade wrote:For a 100 yr event, it is a small price to pay perhaps.....True dat. Initially I was sceptical, but I guess if you total the losses that have occurred i.e. damage to infrastructure i.e. roads,  power lines, electrical equipment, bridges, rail tracks, airport) damage to company assets, lost productivity for companies especially the factories which need road and port infrastructure;  loss of personal property for the lakhs who have water in their houses, and all the submgered  cars and city buses (did not factor in loss of life....) it would easily runs into tens of thousands of crores if not a lot more. This might well be  more expensive than building appropriate infrastructure even if it costs more.."
180,Singha,04 Dec 2015 11:09 ,"the lower middle class and poor whose houses have been submerged will bear the brunt of this. beddings, furniture, clothes all ruined and will need a good clean and dry cycle to recover. electrical and electronic stuff ruined....might be ok if clean and dried up in some cases.houses themselves damaged by standing water.Amma will need to line up a strong benefits pkg to retain her mindshare."
181,ramana,04 Dec 2015 11:12 ,SriKumar considering its Chennaipatnam the total cost of losses and rebuilding will be at least Rs. 100-125K crores. This a major cost. And for common people it could be irreplaceable:  money & jewelery.  Lost documments can be re-generated by the govt.
182,Bade,04 Dec 2015 11:12 ,Upper middle class too...look at the cars floating...more widespread damage than the Tsunami did to Chennai in terms of material loss for sure.
183,habal,04 Dec 2015 11:12 ,she is going to choke that baby .. left it's head hanging.
184,vina,04 Dec 2015 11:15 ,"the lower middle class and poor whose houses have been submerged will bear the brunt of this. beddings, furniture, clothes all ruined and will need a good clean and dry cycle to recover. electrical and electronic stuff ruined....might be ok if clean and dried up in some cases.houses themselves damaged by standing water.Amma will need to line up a strong benefits pkg to retain her mindshare.From what I see and hear, this time the beating has been ""equal opportunity"" . For e.g., my colleague has been moaning for the past 2 days that his chi-chi place in Thoraipakkam has seen water enter the house and into the room where he has stored some expensive paintings and furnishings and stuff (he has let out the remainder of the house and the tenants themselves are in trouble) and estimates a Rs 20L plus loss!Yes, a lot of people have pretty much lost everything that has been kept in the house. Vehicles of course underwater in massive number, total write offs, hopefully can claim insurance on those."
185,chaanakya,04 Dec 2015 11:34 ,"It will take time. Finally rains has abetted and  Sun is shining. Patchy sky with cloud cover is still sending warning signals. If it does not rain, water will drain out. The problem is Chennai has huge catchment area and all waters will have to pass through its rivers, lakes and wetland. Rajali is taking civilian. Flights,  not sure if regular ones. But evacuation. of  stranded. Passengers is on. Electricity  will be restored as water drains out to prevent accidental electrocution. Low lying areas will take some time to drain.Ordinary folks have shown their character in coming out to help. Experience of tsunami  helped in knowing what to do. Even civic agencies have done good work and it is because  of them that casualy  figures are less.Reminded me of Patna flooding when water reached  above first floor .Avoid going out unless familiar with area and on rescue relief work. Stay on higher ground. Today ndrf has more than 50+ teams and they will reach most stranded in low lying colonies."
186,chaanakya,04 Dec 2015 11:38 ,Amma foodAmma waterAmma saltAmma cementAmma rainsAmma rescueAmma releifEverything freeShe will win a resounding majority in may 2016.
187,Singha,04 Dec 2015 11:41 ,"the insurance industry which in india always claims to be under financial stress will get a shockwave from this - property , shop, car insurance claims. same happened after katrina."
188,chetak,04 Dec 2015 11:58 ,"Singha wrote:the insurance industry which in india always claims to be under financial stress will get a shockwave from this - property , shop, car insurance claims. same happened after katrina.very very few in chennai would have actually insured against such damage and very specific clauses are required to be  active in the policy for the insurance companies to pay off.I remember, during the sikh killings, a relative's household articles were were being transported by truck because he was being transferred. The driver was a sikh, he was attacked on the way and the household stuff and the truck burnt along with the unfortunate driver. Even though he was ""fully insured"" he did not receive a single paise. SRCC means jack shit because the insurance simply claimed that they were not liable because the goods had been ""stolen"" and the so called full coverage SRCC policy was not covered for theft.act of god also comes into play for these devious insurance companies.I have ""full"" insurance coverage for house and appliances, but the company did not pay me when a lightening strike  took out some appliances at my farm house. They refused to take my word and demanded to see a ""newspaper"" report about the lightening strike because as per them such a significant event would heve been reported in the press. None of my neighbors also received any compensation for their loss. The extremely jovial insurance agent simply stopped answering our telephone calls and the company office sent the matter into a long closed loop."
189,vina,04 Dec 2015 12:16 ,"the insurance industry which in india always claims to be under financial stress will get a shockwave from this - property , shop, car insurance claims. same happened after katrina.Mumbai too got plastered with rains a few years ago. Similar things would have happened. The city got back on it's feet in two or 3 days. Mumbai is tough and self sufficient. And so is Chennai. Chennai too will be back on it's feet within a week.Leave the victim playing and rhona & dhona to Bengal , Mamata , TMC and their associated whiners. Mark my words. Amma will be ruthless in ramming through flood control and other measures, especially now , given that there will be popular approval for this. There is a precedent for this sort of stuff in Madurai along the riverbanks when it was done earlier.Now expect some serious kind of similar stuff to happen in Chennai as well."
190,hnair,04 Dec 2015 12:22 ,"chetak, insurance is same everywhere in the world.  They will find a 100 loopholes, before paying anything.  Only the auto insurance guys have a well-oiled system, but even there, the denials are quite commonThe Chennai residents will have to apply for national disaster relief funds, if at all they get it.  Most of such funds go towards infra repair.  Tough times indeed."
